{
  "pipeline_version": "3.3",
  "artifact_schema_version": "3.3.0",
  "segmenter_version": "3.3.0",
  "inputs": {
    "project_root": ".",
    "hash_algorithm": "sha256"
  },
  "outputs": {
    "final_script": "10_final_script.md",
    "final_index": "10_final_sentence_index.json",
    "final_integrity": "10_final_integrity.json",
    "artifact_count": 40
  },
  "hashes": {
    "10_final_candidate.md": "4f214e3345a6eb9285cada231018ed8fc6516097d4d9fd64505fb4d1ab072e6a",
    "10_final_script.md": "4f214e3345a6eb9285cada231018ed8fc6516097d4d9fd64505fb4d1ab072e6a",
    "05_script_draft.md": "4f214e3345a6eb9285cada231018ed8fc6516097d4d9fd64505fb4d1ab072e6a",
    "06_script_accessible.md": "4f214e3345a6eb9285cada231018ed8fc6516097d4d9fd64505fb4d1ab072e6a",
    "06_script_pruned.md": "4f214e3345a6eb9285cada231018ed8fc6516097d4d9fd64505fb4d1ab072e6a",
    "07_script_retention_edit.md": "4f214e3345a6eb9285cada231018ed8fc6516097d4d9fd64505fb4d1ab072e6a",
    "08_script_natural.md": "4f214e3345a6eb9285cada231018ed8fc6516097d4d9fd64505fb4d1ab072e6a",
    "09_script_fact_checked.md": "4f214e3345a6eb9285cada231018ed8fc6516097d4d9fd64505fb4d1ab072e6a",
    "00_project_brief.yaml": "7054a110bd84a3991180705426b8a932c003e803ec8704c1d23c03c3b10c44d2",
    "01_angle.md": "ffe1992f23fae101f3e1f6b402487d011719b6f257ae153949a34914d48b37d6",
    "02_research_notes.md": "e552ccf09e44ad43a202352fa84e36e39de3f06ab0fdb84d7bcca509f52b5a08",
    "02_sources.json": "cee6ef722028a1466acda437193621d45e9afb05235b320b5bdb9e215c614417",
    "02_evidence_ledger.json": "d2aaecc327ae70becd3e2d8781f995f2a3efe3a01727ab34eaa145cf9a122a4e",
    "03_claim_map.json": "b6df1d95f8b25606eb9343b9700e5ba9d89c6c6c2cfae8db9c985122cf396084",
    "03_core_subject.json": "d0620ac5976fd12edefc226c8f18cb421e4815fdf47ea8cc98ebbc09b54879e7",
    "03_knowledge_graph.json": "8a768cf83de71d1e1032373d6e8fbe7ce1b1a1d57ad231ad56a4501034e28538",
    "04_story_architecture.md": "0ba8412f68fd75bae827f5bb8adeddfd79a801c5ef385eabe5b3ff90282cb544",
    "05_draft_sentence_index.json": "12d647b990d4e03b7974575ac95711225cd1892c0ad1d31089c4181b8e265b2d",
    "05_lexical_knowledge_sweep.json": "f75a713f4b8d70ce4cb7d2c4d05a94e4ea16f60dd3ad6fb661fc2705c81a5363",
    "05_blind_knowledge_inventory.json": "7bf8251597153fa113d8848cbd278bad049a4613523bb798841326b8a8025ccc",
    "06_knowledge_closure.json": "8052044dd27984dbb16bb4f3752dbd681a6cd22e2e0dfcbb5178136640ce6016",
    "06_audience_report.md": "cb1ca95aff37dacbe8d6d8c6b52865669e484cdddb3fe8f4b459a31f95284eb1",
    "06_terminology_prune.json": "ca8e9760b854e171363fa475322192535028de34134640c2784309c2523a0e05",
    "07_reveal_audit.json": "5d3538c973c9a67bfc348463ff071ed5db2b1c97483903ec264bc91fbce26c34",
    "07_knowledge_delta.json": "28d5fda8a939c8b887e2540ddafb9b017b5ef12a0ecc5fff8e1623296dbe1d0c",
    "07_retention_report.md": "7c77b1b9483e4aa7cc6f7555ecb4cbe5cc4072932859f70d5d93153322cc1cfd",
    "08_naturalness_audit.json": "0a2b0321f7ab3bea44baa6983f12acf48807bb17dfe0bf518d7cbc46a0b90ef5",
    "08_knowledge_delta.json": "14c27965d186257cd648c1bc118170d15d9277dcaeba9840707f09b76344cbda",
    "08_anti_ai_report.md": "c8c3fe3f6afa2b0fa639ac7170b54fa1b91078ceddf24c21b53284b7a9eac5a3",
    "09_claim_strength_audit.json": "7e99a0add44ae0886837c69875f68de116bda71c685b95f2070c81b67189f793",
    "09_knowledge_delta.json": "dc56cdfe0e9127f8ec936ab849e72769ed66e821e703bf004f4da364ce066c22",
    "09_fact_check.md": "9b13d4aec96b0318276d83bbe5086d60d833d9bd7f8bdadb5f20e3e41e898f0b",
    "10_story_report_draft.md": "09b76d4559ef6cf34403406479d21c5fbe40d1d2325bf8cb7556cfd4b604e824",
    "10_final_sentence_index.json": "f8082cb01eeb8087bd853b44af3cdde653415940b528d1ba237542f6de387842",
    "10b1_blind_knowledge_inventory.json": "56d24bde0d948f688e57ed095130840ed6178bb3d14fa68689a3fd42fbd847cf",
    "10b2_blind_claim_inventory.json": "316160d06d4f614cc26bb98865abaf5547e19f7a5a5f3948da702c863211d86b",
    "10b3_blind_naturalness_audit.json": "4b4f46679f97b4a2a9e44d6c62afccbbce4eac61d8e848e063913c40122ad58f",
    "10b_isolation_manifest.json": "0909af7ffbcdeedc80b9f95a930ca06a52fba46f00b1082e8960166de5b7e224",
    "10_final_integrity.json": "03b898f28263dcf8f666f5a26a9bca89c244c5a99ee68fa79b393f227eec6110",
    "10_final_story_report.md": "dcd9be747465b3920228c50ebda32e6972beda79be3ed99b63d59764a648f022"
  }
}
