{
  "pipeline_version": "3.3",
  "artifact_schema_version": "3.3.0",
  "segmenter_version": "3.3.0",
  "inputs": {
    "project_root": ".",
    "hash_algorithm": "sha256"
  },
  "outputs": {
    "final_script": "10_final_script.md",
    "final_index": "10_final_sentence_index.json",
    "final_integrity": "10_final_integrity.json",
    "artifact_count": 40
  },
  "hashes": {
    "10_final_candidate.md": "70d1cf648ee3b19699fe26b49ed10d73d6341adf86b624f21c10b0bf686c4635",
    "10_final_script.md": "70d1cf648ee3b19699fe26b49ed10d73d6341adf86b624f21c10b0bf686c4635",
    "05_script_draft.md": "70d1cf648ee3b19699fe26b49ed10d73d6341adf86b624f21c10b0bf686c4635",
    "06_script_accessible.md": "70d1cf648ee3b19699fe26b49ed10d73d6341adf86b624f21c10b0bf686c4635",
    "06_script_pruned.md": "70d1cf648ee3b19699fe26b49ed10d73d6341adf86b624f21c10b0bf686c4635",
    "07_script_retention_edit.md": "70d1cf648ee3b19699fe26b49ed10d73d6341adf86b624f21c10b0bf686c4635",
    "08_script_natural.md": "70d1cf648ee3b19699fe26b49ed10d73d6341adf86b624f21c10b0bf686c4635",
    "09_script_fact_checked.md": "70d1cf648ee3b19699fe26b49ed10d73d6341adf86b624f21c10b0bf686c4635",
    "00_project_brief.yaml": "5e5f8c7cf12400838f961227375cda1e3f5db2eeea21ea220ba9678427dcf0d2",
    "01_angle.md": "ffe1992f23fae101f3e1f6b402487d011719b6f257ae153949a34914d48b37d6",
    "02_research_notes.md": "e552ccf09e44ad43a202352fa84e36e39de3f06ab0fdb84d7bcca509f52b5a08",
    "02_sources.json": "cee6ef722028a1466acda437193621d45e9afb05235b320b5bdb9e215c614417",
    "02_evidence_ledger.json": "d2aaecc327ae70becd3e2d8781f995f2a3efe3a01727ab34eaa145cf9a122a4e",
    "03_claim_map.json": "b6df1d95f8b25606eb9343b9700e5ba9d89c6c6c2cfae8db9c985122cf396084",
    "03_core_subject.json": "d0620ac5976fd12edefc226c8f18cb421e4815fdf47ea8cc98ebbc09b54879e7",
    "03_knowledge_graph.json": "d1675c5a85571308db5bd34ff9d103fd7f42d38602e5ddbf82e964527b8355fa",
    "04_story_architecture.md": "0ba8412f68fd75bae827f5bb8adeddfd79a801c5ef385eabe5b3ff90282cb544",
    "05_draft_sentence_index.json": "2bf9ba255f4414164c6108858888794c8d0e432148475cde9a2968dc3838f075",
    "05_lexical_knowledge_sweep.json": "5aeb258fb478020bf4f66f1e4ec67dde4e056d3566049b20d156e3315dfcad04",
    "05_blind_knowledge_inventory.json": "b1b858a65473c0894677528375131d2130574bb1534cf38ea012d1736ffff4e0",
    "06_knowledge_closure.json": "cbe0980245b3bb4568e7c14e5ed20ec1698b0398c128a38e5edccb1dbc5e6415",
    "06_audience_report.md": "cb1ca95aff37dacbe8d6d8c6b52865669e484cdddb3fe8f4b459a31f95284eb1",
    "06_terminology_prune.json": "9214a66d5d6635c2d5416a300175d9dba627ff4cad1e0284ebad274289804f14",
    "07_reveal_audit.json": "b656c788ece3f95a14876c25f5be62c5461a3db7f35a4516a3e897eb342ceb2b",
    "07_knowledge_delta.json": "d4aa7be9f95976f7c8d3447f6dc2c1fabf1af7eae7a692a93a84f63ef5fbb47d",
    "07_retention_report.md": "7c77b1b9483e4aa7cc6f7555ecb4cbe5cc4072932859f70d5d93153322cc1cfd",
    "08_naturalness_audit.json": "d11a254bf0a9e7a168903188e7ab31b8886e91846332640f6c76dcb5023be649",
    "08_knowledge_delta.json": "87c22b216ba610a7a388513d1cd38ff51a5f4da24324f9bc0bb0cbde447d9b53",
    "08_anti_ai_report.md": "1e9a35f585c52b5e990c79cb4e44be7e78fe238a9468d53140d724a11b8ba007",
    "09_claim_strength_audit.json": "cb1a147ce14f49a596999b457fb7c44ed4796ab4f568be42fe308d19bd532e1a",
    "09_knowledge_delta.json": "95cb1b0a5c923c8cd3c2e40d95758692506e380d44fce8d495d0ac4febd55708",
    "09_fact_check.md": "9b13d4aec96b0318276d83bbe5086d60d833d9bd7f8bdadb5f20e3e41e898f0b",
    "10_story_report_draft.md": "82991b8777dcb3fdc2894b230eec7d2d6fba8ef42261a5d1207fce02a317ac67",
    "10_final_sentence_index.json": "301a04a0a2df5b670ba9fb8990dfb36235d7c7e18f80f50d0db54121b4a1eded",
    "10b1_blind_knowledge_inventory.json": "b0fc5a4f9d87aa5820089c52e0fad031b5e9ae4af2ea3fe31688740e5dec5b06",
    "10b2_blind_claim_inventory.json": "4b0f73d3165e603f7eb24db2331977425c2c5483ba405791d48bcf3237ac2f91",
    "10b3_blind_naturalness_audit.json": "a8daa6b26c131e04cec3ec8af100b11aeff3e9d471bf82baacff18ff5b61fef6",
    "10b_isolation_manifest.json": "0621bf7de7d7091c8e90f72a6ca8464be13ae27933e6bb030258a785e7be6378",
    "10_final_integrity.json": "75868b51408d764c48adef9d8e5d93f497b9071a5dbfc20b262fee8672196a44",
    "10_final_story_report.md": "a39970def3eda77ac21ab3ad37e42d37cc543577ed2f70fd3efa3616dc7190b7"
  }
}
