{
  "pipeline_version": "3.3",
  "artifact_schema_version": "3.3.0",
  "segmenter_version": "3.3.0",
  "inputs": {
    "project_root": ".",
    "hash_algorithm": "sha256"
  },
  "outputs": {
    "final_script": "10_final_script.md",
    "final_index": "10_final_sentence_index.json",
    "final_integrity": "10_final_integrity.json",
    "artifact_count": 40
  },
  "hashes": {
    "10_final_candidate.md": "1922126eac6f6904ff3382128cabfdd804b546b4a93e13718765a831b1ef1687",
    "10_final_script.md": "1922126eac6f6904ff3382128cabfdd804b546b4a93e13718765a831b1ef1687",
    "05_script_draft.md": "1922126eac6f6904ff3382128cabfdd804b546b4a93e13718765a831b1ef1687",
    "06_script_accessible.md": "1922126eac6f6904ff3382128cabfdd804b546b4a93e13718765a831b1ef1687",
    "06_script_pruned.md": "1922126eac6f6904ff3382128cabfdd804b546b4a93e13718765a831b1ef1687",
    "07_script_retention_edit.md": "1922126eac6f6904ff3382128cabfdd804b546b4a93e13718765a831b1ef1687",
    "08_script_natural.md": "1922126eac6f6904ff3382128cabfdd804b546b4a93e13718765a831b1ef1687",
    "09_script_fact_checked.md": "1922126eac6f6904ff3382128cabfdd804b546b4a93e13718765a831b1ef1687",
    "00_project_brief.yaml": "0e15615187934be2180e9506f34e43d2ef00b03501cd66afb22dca9a580c6698",
    "01_angle.md": "0799050726dbef4bd20d9eb26e9de683d132bf95cc5589756f0fab1bd9b5e027",
    "02_research_notes.md": "59a8924494370a9739a053aed6d1485784a445252e628aced8ec40c7cf104c1a",
    "02_sources.json": "2814fd035f4c5dc04a26eaefa30f0755e699beb2f6655cc491895c4c01281f61",
    "02_evidence_ledger.json": "d8055095d62e6106e3c6dc0a1457ecb68f26807741802d90249120da8505fa77",
    "03_claim_map.json": "a184503a6ef56cf13f279566ccd782b94a50843ea80ed44a558f2d92b651439c",
    "03_core_subject.json": "e193b33557cdfdb2f54d22aa6d28c09c124ce65553d968563800d9711c7586e6",
    "03_knowledge_graph.json": "c9b208492f0aca73bb5fec7ae0c74327f957e5f95c6a455f8ec966a3edfc3ee6",
    "04_story_architecture.md": "0ae9a3521217c1e62d65b6040ece412a996df81cf185442bfdf8f66716365c4e",
    "05_draft_sentence_index.json": "0a29a791eb54e051ac8813320738f846028d2f6e00a5a2202e37b4eb4b17b2ea",
    "05_lexical_knowledge_sweep.json": "7485233436a28f8ee15ae7ca2281dde501505f4517b2e96571779b05b074543e",
    "05_blind_knowledge_inventory.json": "1ebf205f279dbbae6bb1f90862b94096352210dd738b8d866070bd64ff41968c",
    "06_knowledge_closure.json": "4d8ec86c1bce2e1bd6bc00bf8be85db33da1df561a8c396f0e326df7718a2de2",
    "06_audience_report.md": "042de22d4bcef618b0650853b71848d8579b78df285527e0a354271785a8d6f9",
    "06_terminology_prune.json": "dee173bbca07101abbcfefb1537b3ce289dee69b163214b33767fe41d8f8914d",
    "07_reveal_audit.json": "ee2f01e546c1b3814cc3807e98990a21869a52dda41ec28b56fa07b102056566",
    "07_knowledge_delta.json": "df81f944082df1ebc3ef8c0dcaa0345950e5a69998bb9f2ff962ca0a04821a65",
    "07_retention_report.md": "e2aba432d63f0f60dbc0ab30a0f7198221f078d94c475f9e4dc51fcf2b096bab",
    "08_naturalness_audit.json": "8bd5f1b4bbeda2edb69185b93f5403095a5ce0162ee7e59d6b000b0287139084",
    "08_knowledge_delta.json": "d98d569237ca34edbc033e52bec8d56fa81d75225c45892051ce9e3e194843cf",
    "08_anti_ai_report.md": "e93cdd73af963dd17ce973ab21e3ee4a5353d6fe9822da4a5b81ed214f754fde",
    "09_claim_strength_audit.json": "509c750a01c75ca3139ba27f4f3b2d1c6abc8e7d14a115bd3815134befffde82",
    "09_knowledge_delta.json": "662b2658632a2adf423c08ae667f4d902fcdf7e9d7aea2130fbdebcec6dc456f",
    "09_fact_check.md": "37986d481095151592e46631455e4b7114e5385329834e93e19f3255725abb3b",
    "10_story_report_draft.md": "207b5bcad3c885204d88d3da4980d43cc350f719e40e70748c4d56f08d42ed4c",
    "10_final_sentence_index.json": "50dd6292ea197d95aece5451c941cdf1c50f9d56ed22e43ebd06ecd2c655b018",
    "10b1_blind_knowledge_inventory.json": "748c3e5e927db37bcddbd74265c66654af516e5f5ae5a09a85719c38370dbeea",
    "10b2_blind_claim_inventory.json": "126d160866b8467f8b26455c6a683bb078360faeadb8dd25abcbc14262e8b24d",
    "10b3_blind_naturalness_audit.json": "a3e1952267c1757cd354e9a85a8f3c7a743cecc42bd07c400f3a208b17006414",
    "10b_isolation_manifest.json": "f2700d80edd4027a0b24bcf7072f86c75f57a8f8f235514ca6df6288794c6efc",
    "10_final_integrity.json": "ca06e064624b4451fef8b3c87fe14522e01a617d0b52a42792e25fd716b8fef1",
    "10_final_story_report.md": "4c10b15cdbb905c3075f28075fdec554d89e3dbbfc1934918a2636a2c47b2284"
  }
}
