{
  "pipeline_version": "3.3",
  "artifact_schema_version": "3.3.0",
  "segmenter_version": "3.3.0",
  "inputs": {
    "project_root": ".",
    "hash_algorithm": "sha256"
  },
  "outputs": {
    "final_script": "10_final_script.md",
    "final_index": "10_final_sentence_index.json",
    "final_integrity": "10_final_integrity.json",
    "artifact_count": 40
  },
  "hashes": {
    "10_final_candidate.md": "d00a957fca30a37626f5f34ec030863acd9df4336c9762a507f17bcb6449b520",
    "10_final_script.md": "d00a957fca30a37626f5f34ec030863acd9df4336c9762a507f17bcb6449b520",
    "05_script_draft.md": "d00a957fca30a37626f5f34ec030863acd9df4336c9762a507f17bcb6449b520",
    "06_script_accessible.md": "d00a957fca30a37626f5f34ec030863acd9df4336c9762a507f17bcb6449b520",
    "06_script_pruned.md": "d00a957fca30a37626f5f34ec030863acd9df4336c9762a507f17bcb6449b520",
    "07_script_retention_edit.md": "d00a957fca30a37626f5f34ec030863acd9df4336c9762a507f17bcb6449b520",
    "08_script_natural.md": "d00a957fca30a37626f5f34ec030863acd9df4336c9762a507f17bcb6449b520",
    "09_script_fact_checked.md": "d00a957fca30a37626f5f34ec030863acd9df4336c9762a507f17bcb6449b520",
    "00_project_brief.yaml": "9154673aa084f079ae56edcea5daa3e8482fbcb978ae3164728b26ca80a51646",
    "01_angle.md": "0799050726dbef4bd20d9eb26e9de683d132bf95cc5589756f0fab1bd9b5e027",
    "02_research_notes.md": "59a8924494370a9739a053aed6d1485784a445252e628aced8ec40c7cf104c1a",
    "02_sources.json": "2814fd035f4c5dc04a26eaefa30f0755e699beb2f6655cc491895c4c01281f61",
    "02_evidence_ledger.json": "d8055095d62e6106e3c6dc0a1457ecb68f26807741802d90249120da8505fa77",
    "03_claim_map.json": "a184503a6ef56cf13f279566ccd782b94a50843ea80ed44a558f2d92b651439c",
    "03_core_subject.json": "e193b33557cdfdb2f54d22aa6d28c09c124ce65553d968563800d9711c7586e6",
    "03_knowledge_graph.json": "7cd6999ab66d3e60e403348f1af06198bc1e8c2d41e4efa683d9a3e8a4ac56e2",
    "04_story_architecture.md": "0ae9a3521217c1e62d65b6040ece412a996df81cf185442bfdf8f66716365c4e",
    "05_draft_sentence_index.json": "19c53c3b4a1e28b5f13c89ef50e8593c33c8bb49cff63e5d9400f3b74a89c681",
    "05_lexical_knowledge_sweep.json": "6f686cbb8e02b7a1691f330753c6d4dde908c5b1d30c3ff9462b2e94b4c81cf0",
    "05_blind_knowledge_inventory.json": "eb12c00c6e7af6033fab0e53d9997c6bf518ee9b49e8fe597219bc698beec9d4",
    "06_knowledge_closure.json": "5ba232e258ee53233b6922a3fa9f1fb3802f2439f605c63006d61301f6a6f017",
    "06_audience_report.md": "fc48b54a181417b6e3939ad08ab2bf335fa96ecb4d05a380f6cb83b0537f8d13",
    "06_terminology_prune.json": "d5166637bfdb0a14d73ce3d89e75a83b1819195e164a6539a5588a5d64d75d0d",
    "07_reveal_audit.json": "bfd019d721c037b0a3dd373d011e5c27016dd4e779e511e782950a1b50b9a580",
    "07_knowledge_delta.json": "ad5f2b0bcef4be41c5781310b8d32a08973a772476d66540de89de3f2db47970",
    "07_retention_report.md": "e2aba432d63f0f60dbc0ab30a0f7198221f078d94c475f9e4dc51fcf2b096bab",
    "08_naturalness_audit.json": "f49c1e91b445fb3418923804295bbabb1c5b9548418f4c71ceb30c576b9609c3",
    "08_knowledge_delta.json": "38884c2c6c7c2d3cd409e3e9245ec9f35f5bd0bbf4e08217a3b5e854d1260325",
    "08_anti_ai_report.md": "33c37b9d422bb09b22d0e73fd96eec7965aeb84f2ef52b777cb380287b704df9",
    "09_claim_strength_audit.json": "35d233d31dedfe5ad35ea273afe713274e1af8b816aa26cbe35422b5568dae48",
    "09_knowledge_delta.json": "c7ea2dea83dae3ab783381672b5aa72a413390a08a0290e09a994b1947037594",
    "09_fact_check.md": "37986d481095151592e46631455e4b7114e5385329834e93e19f3255725abb3b",
    "10_story_report_draft.md": "ebce4142f7fe815625b1b6f34c4899ca5a6a781ff5a0954e341d290e1ad75d82",
    "10_final_sentence_index.json": "2cc5f4eef532dee1af83f06b34bd0410913ba53a90843fd18e510432a8d5b1c9",
    "10b1_blind_knowledge_inventory.json": "f530a9bda07466bb2bb17e27a48965a54dbcf2b17fef3fa7b2231c8aef374900",
    "10b2_blind_claim_inventory.json": "0b387ce152df51a78e8824ae031aaad33d7d00857c8eeba1f18039e9ee8ad1d0",
    "10b3_blind_naturalness_audit.json": "a50ffb6876ae42644663b3dca9465e8699768245feb2861ccfda07348a0129dc",
    "10b_isolation_manifest.json": "d2f479a0978690f8b0eeb24e7ad98e17a95f95e86c03a31dbcb9442e4988af1c",
    "10_final_integrity.json": "b0a8031fbf6f29745a1ccc62439157408d3bea25206d1020bc349e69749231e1",
    "10_final_story_report.md": "bd20a733788550a5f2d1452430a40c020f8c2129933961f3a83d2a9907812da7"
  }
}
