{
  "pipeline_version": "3.3",
  "artifact_schema_version": "3.3.0",
  "segmenter_version": "3.3.0",
  "inputs": {
    "topic": "cách con người thuần hoá chó",
    "language": "vi-VN",
    "duration_minutes": 25
  },
  "outputs": {
    "released_script": "10_final_script.md",
    "final_integrity": "10_final_integrity.json",
    "isolation_status": "ISOLATION_NOT_VERIFIED"
  },
  "hashes": {
    "00_project_brief.yaml": "27d836ea256d75a080596b8fd324df9afd3d759a432d8fb5008a0d2319ff0453",
    "01_angle.md": "8b97005cd94dd164251e990b533079b08cf411e91940845a751330a89aa68009",
    "02_research_notes.md": "0deeec64bf055dd383367278b49518e41033c8d280f0b5fb5e8956290abd2b21",
    "02_sources.json": "9e72f3f5ede03773e684023b314578fa417fe6b609f1a39ff9b909522813b808",
    "02_evidence_ledger.json": "d2b1194afad1a2a890077a58d1d1c437ee2c89104b446077a9f611e42063adc2",
    "03_core_subject.json": "6f393c98c347985d95b6da96dbd17add4c5ae2bf1c0fa2965256fcbc3333f8ca",
    "03_claim_map.json": "e013b9ab52b4575f39e7c71ce64edbced107f1bcd014fdb640100d4d87b2704f",
    "03_knowledge_graph.json": "2375401c28f769ace7c21616142257d249c2dcb94d0fe185a07ba72cf2c98dea",
    "04_story_architecture.md": "ae1c2bab72f24a53fc6d5c935cca59fe57a864030324252e6929ea8cde1b24a7",
    "05_script_draft.md": "bbe67e7718b1d99c39e5616abf0e8ae45321e529ed719e3a458d7fedc6284bcd",
    "05_draft_sentence_index.json": "11c13873d1afc6c81cc655384ea8fd951e6c3fe561263ba441c6ab65d68693fc",
    "05_lexical_knowledge_sweep.json": "0fa1ef277dba4280d9c6ed84b7a2c22c42086ad61c8726f251de49477cdeaea0",
    "05_blind_knowledge_inventory.json": "5236481ff226ead9952551daae456027d2d61ebc50c8f20e44e4472ac4da6a30",
    "06_audience_report.md": "de1b3349ef4a33b8c05997fbbcbe0d4d0fe9b2bb8f1405737cf821dcb5285300",
    "06_knowledge_closure.json": "93064e1916c336a5da7f712bf9e9bb493d300c090663ea76267bfe69ec417545",
    "06_script_accessible.md": "bbe67e7718b1d99c39e5616abf0e8ae45321e529ed719e3a458d7fedc6284bcd",
    "06_terminology_prune.json": "5582e93549a3c523cda32af389c004c2fe3f0fa4ba6b9bfe791b0c7b8f3855e9",
    "06_script_pruned.md": "bbe67e7718b1d99c39e5616abf0e8ae45321e529ed719e3a458d7fedc6284bcd",
    "07_retention_report.md": "854bd7b708fae9601a93ffcb5797c8fe1e7aebbd8d705851b036e93db039817a",
    "07_reveal_audit.json": "25860176fb02d43c264518a26c3aae0e268b7db0841756825f512eb002c355e5",
    "07_knowledge_delta.json": "e6cfde467c8230b13071bbf50dcc648ad77e0be08836cb84fd553ce6b0e5ea62",
    "07_script_retention_edit.md": "bbe67e7718b1d99c39e5616abf0e8ae45321e529ed719e3a458d7fedc6284bcd",
    "08_anti_ai_report.md": "c8710cbea4085841800370ad271617608d8cd71c26ae781b3b65b222f00b0112",
    "08_naturalness_audit.json": "8b46f0c1f8d38395ba7064c6be057160791f881e4852339ee16435415e0241b5",
    "08_knowledge_delta.json": "24fbbe870658ba10da8aa8ad43d1fdc27d0e1ebc37e380cfcbb28f1aeaa912dd",
    "08_script_natural.md": "bbe67e7718b1d99c39e5616abf0e8ae45321e529ed719e3a458d7fedc6284bcd",
    "09_fact_check.md": "35f82ee2d9bc90e6bcd33bd9e2ec352fdf6f1e1c3ff01144463da1361a3bc0bb",
    "09_claim_strength_audit.json": "cc4cecbc25fff805248b28e1047385c3b6066e4c0b2cab9d6eb47d349c24758d",
    "09_knowledge_delta.json": "dd4a232417756f20d9e7f6233156f9820f88af5eff5814d00dedd6a51832d363",
    "09_script_fact_checked.md": "bbe67e7718b1d99c39e5616abf0e8ae45321e529ed719e3a458d7fedc6284bcd",
    "10_story_report_draft.md": "d5f7a81695410459320325d30b506cd37bf702979b3b8d36be01d1cac2f0df4a",
    "10_final_candidate.md": "bbe67e7718b1d99c39e5616abf0e8ae45321e529ed719e3a458d7fedc6284bcd",
    "10_final_sentence_index.json": "22c146e9e9b518e71449425210c069120323ea2c9a00c748bfb2a5a8fb4dc7af",
    "10b_isolation_manifest.json": "9cdd15b4fddeb99479fda2661bb2ba4db660120b126c4c63138d1d09a11b1de0",
    "10b1_blind_knowledge_inventory.json": "29d46e02a2d8ce0fbde85a66764719f4ec7881ccd7a7fab9eda179b6f874e520",
    "10b2_blind_claim_inventory.json": "0139d931da7cb33e210b9b9c185b8ad0e7d0093e3c9452ba761bcf2a72286bec",
    "10b3_blind_naturalness_audit.json": "906ae8f6548b502a75fb0bb59f4f90077193c4592226ffe253ebf4c622c12e9c",
    "10_final_story_report.md": "e2b21f56038cd3da6c676051453559e734b07a07147c287069f672e7ee2383de",
    "10_final_integrity.json": "5f60f366cfd230cba220e7bd5438da28dd714b82b5be0cc0cf31634ed214f88a",
    "10_final_script.md": "bbe67e7718b1d99c39e5616abf0e8ae45321e529ed719e3a458d7fedc6284bcd"
  }
}
