{
  "pipeline_version": "3.3",
  "artifact_schema_version": "3.3.0",
  "segmenter_version": "3.3.0",
  "inputs": {
    "project_root": ".",
    "hash_algorithm": "sha256"
  },
  "outputs": {
    "final_script": "10_final_script.md",
    "final_index": "10_final_sentence_index.json",
    "final_integrity": "10_final_integrity.json",
    "artifact_count": 40
  },
  "hashes": {
    "10_final_candidate.md": "d8e524a3496a486d919ca96f5b550f4c8644520a54cfdc676362a7eaf6a00814",
    "10_final_script.md": "d8e524a3496a486d919ca96f5b550f4c8644520a54cfdc676362a7eaf6a00814",
    "05_script_draft.md": "d8e524a3496a486d919ca96f5b550f4c8644520a54cfdc676362a7eaf6a00814",
    "06_script_accessible.md": "d8e524a3496a486d919ca96f5b550f4c8644520a54cfdc676362a7eaf6a00814",
    "06_script_pruned.md": "d8e524a3496a486d919ca96f5b550f4c8644520a54cfdc676362a7eaf6a00814",
    "07_script_retention_edit.md": "d8e524a3496a486d919ca96f5b550f4c8644520a54cfdc676362a7eaf6a00814",
    "08_script_natural.md": "d8e524a3496a486d919ca96f5b550f4c8644520a54cfdc676362a7eaf6a00814",
    "09_script_fact_checked.md": "d8e524a3496a486d919ca96f5b550f4c8644520a54cfdc676362a7eaf6a00814",
    "00_project_brief.yaml": "752daddb38130ce041224ac54a192f65f09487249b0b7ed83aada1423765a3a1",
    "01_angle.md": "ffe1992f23fae101f3e1f6b402487d011719b6f257ae153949a34914d48b37d6",
    "02_research_notes.md": "e552ccf09e44ad43a202352fa84e36e39de3f06ab0fdb84d7bcca509f52b5a08",
    "02_sources.json": "cee6ef722028a1466acda437193621d45e9afb05235b320b5bdb9e215c614417",
    "02_evidence_ledger.json": "d2aaecc327ae70becd3e2d8781f995f2a3efe3a01727ab34eaa145cf9a122a4e",
    "03_claim_map.json": "b6df1d95f8b25606eb9343b9700e5ba9d89c6c6c2cfae8db9c985122cf396084",
    "03_core_subject.json": "d0620ac5976fd12edefc226c8f18cb421e4815fdf47ea8cc98ebbc09b54879e7",
    "03_knowledge_graph.json": "3c35da9754d62e185dc2f65cd5a5406cfb57914ae03d8fe619eaa4099515baff",
    "04_story_architecture.md": "0ba8412f68fd75bae827f5bb8adeddfd79a801c5ef385eabe5b3ff90282cb544",
    "05_draft_sentence_index.json": "5c95b703942f0e6564aa0b2a88e04e65773a01812775c55c3ecf44295efa6a1f",
    "05_lexical_knowledge_sweep.json": "6e0a8048d8350a9671e7ad07f6531a1d3923a505c53b631cf92dfa0aaa5bb1a4",
    "05_blind_knowledge_inventory.json": "0dc9b5b9d2db3bdf7f2a103df095768a0243f618df1ea62deaf0efb555f8c470",
    "06_knowledge_closure.json": "6d8cfabacbf4578035f49bb40e407dbd18700dff2a070c9d3832c9a243e4bccd",
    "06_audience_report.md": "cb1ca95aff37dacbe8d6d8c6b52865669e484cdddb3fe8f4b459a31f95284eb1",
    "06_terminology_prune.json": "8ab97b22b71c3bdc2018b8a7a43c66993d6a01672af63d7785820e6f02d5180b",
    "07_reveal_audit.json": "6637a8bad945964a8e307c7d5ae8e5019218126ec14bc95cbda940e3c803b53d",
    "07_knowledge_delta.json": "af7b6aff1f8c0f5ea4a9ad136e149fe31f916b2ff3fb0b4d7cd3f11449db45c6",
    "07_retention_report.md": "7c77b1b9483e4aa7cc6f7555ecb4cbe5cc4072932859f70d5d93153322cc1cfd",
    "08_naturalness_audit.json": "eac6be6ea65eae1cf63782f47f3ed47341181b7d250899265d39c2167086000a",
    "08_knowledge_delta.json": "34232b1510ccb2fef04b12a29cd096d4bf0161290b3ce5f907ef17f9b3dbea7e",
    "08_anti_ai_report.md": "ed72b51ee16628f057612a7e026734b62b478e1f75e532261d9f7455a6291119",
    "09_claim_strength_audit.json": "f868f6cecdf37b90ea02dfb56b23347ab32c7ceb0a148619876dfafc76921a88",
    "09_knowledge_delta.json": "e20ef1d21ace94383e97de92d1ce5059b3b40c45d9f901f17b9b38fe09723ebc",
    "09_fact_check.md": "9b13d4aec96b0318276d83bbe5086d60d833d9bd7f8bdadb5f20e3e41e898f0b",
    "10_story_report_draft.md": "2fd67aa91d8a9ad319b32049c451b10a091601f0edc5322d00ce0731259d7cb8",
    "10_final_sentence_index.json": "58b93097072a741fde04e5ce914e697149f838ae6e582d1834594a6a8a7b619d",
    "10b1_blind_knowledge_inventory.json": "938717a55c674c63383a9835c2ab6a4f1bdc7b11552a5a172bb8fb401bacf30b",
    "10b2_blind_claim_inventory.json": "47f74b42734baa7ba69bfb6ab33ba90ed47f7f5f203f0ecc89d2da2eeba8bb25",
    "10b3_blind_naturalness_audit.json": "e08cc93cdf1fc672760cc1d032405390cc0b991b470a7c9fc5db25a15637cf94",
    "10b_isolation_manifest.json": "2d34629c7dcdc87b43ec94a7a74773afcb12dbd43d9657732d9333f2587c3217",
    "10_final_integrity.json": "4927ffc40e0502cd42da13b100e3d77a37926b20ea45599a43693a7b85da59ac",
    "10_final_story_report.md": "3c2c3ef6d4a72433b3648975e0c5b3831fedd57aee5fbb06e794e05454c03e57"
  }
}
